{
  "schema": "shellx-motion/receipt@1",
  "id": "adapter-lowering-lottie-1ff4ab888fb91800",
  "operation": "adapter.lower",
  "status": "passed",
  "packageId": "pkg_dotlottie_daab0c4090a2321c",
  "inputHashes": {
    "source": "3c9fe1f3ffd55847c0638888a326cf265f660d9332bdc61767b6ff244656b76d"
  },
  "createdAt": "2026-08-26T00:00:00.000Z",
  "lane": "adapter",
  "output": {
    "adapterId": "adapter.lottie",
    "format": "lottie",
    "motionId": "motion_lottie_3c9fe1f3ffd55847",
    "motionSha256": "1ff4ab888fb9180000dcc9921d663ba40f35418f2c75bfb44f25e0cda7ab7a99",
    "layerCount": 2,
    "bundledImageCount": 0,
    "bundledFontCount": 0,
    "lossiness": {
      "level": "none",
      "budget": "No unsupported feature loss detected by the current diagnostic parser.",
      "unsupportedCount": 0,
      "warningCount": 0,
      "supportedCount": 11
    },
    "acceptedWarningFeatures": [],
    "dotLottieBackground": {
      "source": 574934271,
      "motion": "#2244ccff"
    }
  },
  "warnings": []
}
